created_at,tweet_id,tweet_text,screen_name,name,account_creation_date,urls
2021-01-29 17:20:05,1355204078838673424,"En sus primeros nueve días en la presidencia, Joe Biden ha firmado más de 40 decretos para revertir leyes del manda… https://t.co/43qgMVM80n",CNNEE,CNN en Español,Tue Apr 21 12:14:47 +0000 2009,"[{'url': 'https://t.co/43qgMVM80n', 'expanded_url': 'https://twitter.com/i/web/status/1355204078838673424', 'display_url': 'twitter.com/i/web/status/1…', 'indices': [117, 140]}]"
2021-01-29 17:10:04,1355201559458705409,"5 cosas: Novavax anuncia efectividad de su vacuna: 89%, y más

https://t.co/zGZOetpAne",CNNEE,CNN en Español,Tue Apr 21 12:14:47 +0000 2009,"[{'url': 'https://t.co/zGZOetpAne', 'expanded_url': 'https://cnn.it/2YtPDJo', 'display_url': 'cnn.it/2YtPDJo', 'indices': [63, 86]}]"
2021-01-29 17:00:26,1355199132944773123,"La pandemia cerró los tribunales de inmigración y retrasó los casos, lo que provocó que los migrantes se quedaran e… https://t.co/bH3w3qMTk4",CNNEE,CNN en Español,Tue Apr 21 12:14:47 +0000 2009,"[{'url': 'https://t.co/bH3w3qMTk4', 'expanded_url': 'https://twitter.com/i/web/status/1355199132944773123', 'display_url': 'twitter.com/i/web/status/1…', 'indices': [117, 140]}]"
2021-01-29 16:50:06,1355196532463710214,"En una decisión histórica, la Jurisdicción Especial para la Paz convocó a ocho exmiembros de la desmovilizada guerr… https://t.co/OOtMJcylba",CNNEE,CNN en Español,Tue Apr 21 12:14:47 +0000 2009,"[{'url': 'https://t.co/OOtMJcylba', 'expanded_url': 'https://twitter.com/i/web/status/1355196532463710214', 'display_url': 'twitter.com/i/web/status/1…', 'indices': [117, 140]}]"
2021-01-29 16:44:07,1355195025802600449,"El auge de Robinhood significa que la capacidad de comprar acciones, por capricho, está ahora al alcance de todos. https://t.co/AZIDo6DYUx",CNNEE,CNN en Español,Tue Apr 21 12:14:47 +0000 2009,"[{'url': 'https://t.co/AZIDo6DYUx', 'expanded_url': 'https://cnn.it/2YtRzSl', 'display_url': 'cnn.it/2YtRzSl', 'indices': [115, 138]}]"
2021-01-29 16:40:05,1355194012320333825,"México superó a la India en muertes por covid-19 y es el tercer país con más personas fallecidas por la pandemia, s… https://t.co/aXqJAmaRan",CNNEE,CNN en Español,Tue Apr 21 12:14:47 +0000 2009,"[{'url': 'https://t.co/aXqJAmaRan', 'expanded_url': 'https://twitter.com/i/web/status/1355194012320333825', 'display_url': 'twitter.com/i/web/status/1…', 'indices': [117, 140]}]"
2021-01-29 16:35:02,1355192742213726208,"Detectan nueva variante de covid-19 en Estados Unidos en personas sin historial de viajes

https://t.co/RxoAtdJIQE",CNNEE,CNN en Español,Tue Apr 21 12:14:47 +0000 2009,"[{'url': 'https://t.co/RxoAtdJIQE', 'expanded_url': 'https://cnn.it/3iYGe61', 'display_url': 'cnn.it/3iYGe61', 'indices': [91, 114]}]"